<?xml version="1.0" encoding="UTF-8"?>
<!--Sample XML file generated by XMLSpy v2025 rel. 2 (x64) (http://www.altova.com)-->
<n1:REQUEST xmlns:xsi="http://www.w3.org/2001/XMLSchema-instance" xmlns:n1="https://www.transactiontree.com/schema/loyalty/findCustomersB/1.0" xsi:schemaLocation="https://www.transactiontree.com/schema/loyalty/findCustomersB/1.0 findCustomersB.xsd">
	<n1:CRITERIA>
		<n1:CUSTOMER_ID>String</n1:CUSTOMER_ID>
		<n1:SYSTEM_REFERENCE>BRAND_D_CUST_ID</n1:SYSTEM_REFERENCE>
		<n1:SYSTEM_REFERENCE_ID>String</n1:SYSTEM_REFERENCE_ID>
		<n1:FIRST_NAME>String</n1:FIRST_NAME>
		<n1:LAST_NAME>String</n1:LAST_NAME>
		<n1:CITY>String</n1:CITY>
		<n1:STATE>String</n1:STATE>
		<n1:PROVINCE>String</n1:PROVINCE>
		<n1:ZIP_CODE>a</n1:ZIP_CODE>
		<n1:ZIP4>a</n1:ZIP4>
		<n1:EMAIL_ID>^+@-.AA$</n1:EMAIL_ID>
		<n1:PHONE_NUMBER>a</n1:PHONE_NUMBER>
		<n1:STORE_ID>String</n1:STORE_ID>
		<n1:RECORDS_LIMIT>1</n1:RECORDS_LIMIT>
		<n1:REQUEST_DATE>String</n1:REQUEST_DATE>
	</n1:CRITERIA>
</n1:REQUEST>
